Meeting ID,Meeting Notes or MinutesMEET001,Discussed client's requirements and expectations.MEET002,Conducted interactive exercises and group discussions.MEET003,Connected with industry professionals and potential partners.MEET004,Presented the business idea and value proposition.MEET005,Reviewed sales performance and targets.MEET006,Conducted training on a specific skill or topic.MEET007,Showcased the features and functionality of the product.MEET008,Generated ideas and explored creative solutions.MEET009,Prepared and delivered a persuasive pitch.MEET010,Provided guidance and advice to mentees.MEET011,"Introduced project objectives, scope, and timeline."MEET012,Conducted interviews with potential candidates.MEET013,Discussed strategic initiatives and business challenges.MEET014,Reviewed organizational goals and objectives.MEET015,Discussed client's requirements and expectations.MEET016,Brainstormed ideas and generated innovative solutions.MEET017,Provided hands-on exercises and practical demonstrations.MEET018,Addressed investor questions and concerns.MEET019,Discussed strategies to increase revenue and market share.MEET020,Explored collaboration opportunities.MEET021,Identified potential opportunities and challenges.MEET022,Highlighted the unique selling points and competitive advantage.MEET023,hared personal experiences and lessons learned.MEET024,Allocated resources and assigned roles and responsibilities.MEET025,Solicited feedback from participants and addressed their questions.MEET026,Conducted interviews with potential candidates.MEET027,Sought advice and recommendations from board members.MEET028,Analyzed market trends and competitive landscapeMEET029,Evaluated participants' understanding and addressed queries.MEET030,Discussed client's requirements and expectations.
